{
  "schemaVersion": 1,
  "id": "m3-classic.compose-material3-1.4.0",
  "materialProfile": "classic",
  "referenceVersion": "androidx.compose.material3:material3:1.4.0",
  "stability": "stable",
  "releaseDate": "2025-09-24",
  "retrievedAt": "2026-09-01",
  "sourcePrecedence": [
    "material-guideline",
    "androidx-implementation",
    "androidx-release-notes"
  ],
  "sources": [
    {
      "id": "m3-buttons",
      "kind": "material-guideline",
      "title": "Material 3 Buttons specifications",
      "uri": "https://m3.material.io/components/buttons/specs",
      "notes": "Normative component guidance for the five built-in button styles."
    },
    {
      "id": "m3-design-tokens",
      "kind": "material-guideline",
      "title": "Material 3 Design tokens",
      "uri": "https://m3.material.io/foundations/design-tokens",
      "notes": "Normative design-token terminology and role hierarchy."
    },
    {
      "id": "m3-states",
      "kind": "material-guideline",
      "title": "Material 3 Applying states",
      "uri": "https://m3.material.io/foundations/interaction/states/applying-states",
      "notes": "Normative interaction-state terminology."
    },
    {
      "id": "androidx-material3-1.4.0",
      "kind": "androidx-implementation",
      "title": "AndroidX Compose Material3 1.4.0 artifact",
      "uri": "https://dl.google.com/dl/android/maven2/androidx/compose/material3/material3/1.4.0/material3-1.4.0.pom",
      "artifact": "androidx.compose.material3:material3",
      "version": "1.4.0",
      "releaseDate": "2025-09-24",
      "notes": "Immutable executable-reference coordinate in Google's Maven repository."
    },
    {
      "id": "androidx-material3-source-1.4.0",
      "kind": "androidx-implementation",
      "title": "AndroidX Compose Material3 1.4.0 immutable source tree",
      "uri": "https://android.googlesource.com/platform/frameworks/support/+/5113b82a4ed6416d6344efa50e41db8cb65928ff/compose/material3",
      "artifact": "androidx.compose.material3:material3",
      "version": "1.4.0",
      "releaseDate": "2025-09-24",
      "revision": "5113b82a4ed6416d6344efa50e41db8cb65928ff",
      "notes": "Release-tip source revision linked by the official 1.4.0 release notes; assertion locators are relative to this tree."
    },
    {
      "id": "androidx-material3-release-1.4.0",
      "kind": "androidx-release-notes",
      "title": "AndroidX Compose Material3 1.4.0 release notes",
      "uri": "https://developer.android.com/jetpack/androidx/releases/compose-material3#1.4.0",
      "artifact": "androidx.compose.material3:material3",
      "version": "1.4.0",
      "releaseDate": "2025-09-24"
    }
  ],
  "comparisonPolicy": {
    "classifications": [
      "MUST_MATCH",
      "PLATFORM_ADAPTATION",
      "QTMATERIAL_EXTENSION"
    ],
    "domains": [
      "geometry",
      "tokens",
      "colors",
      "typography",
      "states",
      "motion",
      "accessibility",
      "behavior"
    ],
    "defaultGeometryToleranceDp": 0.5,
    "defaultColorMetric": "semantic-token",
    "typographyRasterPolicy": "spec-not-glyph-pixels"
  },
  "notes": [
    "Classic and Expressive are independent reference profiles.",
    "Material guidance is normative; the pinned AndroidX artifact is the executable reference.",
    "Raw glyph-pixel identity is not required across Qt, Skia and platform font stacks."
  ]
}
